{
  "artifact_id": "CQS-CQC-P2-02-R1",
  "schema_version": "0.1",
  "source_narrative_sha256": "37f34e945191656a338bfec3cee788dd959cccc3bdbe94fc60171ff88a5a8df4",
  "source_narrative": "\"Virtual Cel\"产生了哪些新的研究范式？\n",
  "questions": [
    {
      "question_id": "CQ-01",
      "statement": "『Virtual Cell』领域中哪些工作构成可辨识的新研究范式？",
      "source_trace": [
        {
          "exact_quote": "产生了哪些新的研究范式"
        }
      ],
      "question_type": "NOVELTY_OR_PRIOR_ART",
      "dependencies": [],
      "resolution_condition": "证据条件：候选范式级工作的公开记录——候选空间由证据生成（综述、立场文章、计划/资源声明中对范式归属的自述与互认），多来源不再新增类别时达到饱和。任何先验候选清单只能作为待检证据进入，不得作为预置答案。",
      "uncertainty": "『新范式』判定基准原话未给出；先宽收候选，判定留待基准厘清。原文拼写 \"Virtual Cel\"（少一个 l），按领域解读处理并保留于此记录。"
    },
    {
      "question_id": "CQ-02",
      "statement": "『新研究范式』在此请求中的判定基准是什么（方法学共同体实践转变？数据基础设施形成？假说生成方式改变？）？",
      "source_trace": [
        {
          "exact_quote": "新的研究范式"
        }
      ],
      "question_type": "TERMINOLOGY_OR_NAMING",
      "dependencies": [],
      "resolution_condition": "证据条件：操作者确认或领域权威对范式判定基准的使用先例。基准确立后对 CQ-01 候选清单做最终筛选。",
      "uncertainty": "判定基准是本案例最大的未消歧点；不同基准产生不同答案。"
    },
    {
      "question_id": "CQ-03",
      "statement": "各候选范式与其所扩展或取代的既有范式之间的谱系关系是什么？",
      "source_trace": [
        {
          "exact_quote": "产生了哪些新的研究范式"
        }
      ],
      "question_type": "HISTORICAL_LINEAGE",
      "dependencies": [
        "CQ-01"
      ],
      "resolution_condition": "证据条件：每个候选范式与既有范式之间的承继/扩展/取代关系的文献记录。谱系映射完成后『新』的主张获得可核验依据。",
      "uncertainty": null
    }
  ]
}
