{
  "artifact_id": "CQS-CQC-P0-C",
  "schema_version": "0.1",
  "source_narrative_sha256": "81a0ad71e3206dcaf0bb67d1ca919afb9004706446634130419d120572d803c2",
  "source_narrative": "# Narrative C — Hyperbaric oxygen and ovarian reserve (mechanism / mixed narrative)\n\n## Research intent\n\nA clinical collaborator asked whether hyperbaric oxygen therapy (HBOT) could harm ovarian reserve in women of reproductive age, because patients in our center sometimes report menstrual-cycle changes after multi-session HBOT courses.\n\nThe mechanistic background cuts both ways: oxidative stress is a known contributor to ovarian reserve decline, via reactive oxygen species driving primordial follicle over-activation and atresia; yet HBOT is also reported to upregulate antioxidant defenses in some tissues.\n\nSo the net direction of the redox effect in ovarian tissue under repeated hyperoxic exposure is genuinely unresolved.\n\n## What the literature seems to say\n\nAnimal studies of ovarian ischemia-reperfusion injury report that HBOT preoperatively can preserve ovarian follicle reserve, measured by AMH levels, antral follicle counts, and histological primordial follicle counts.\n\nClinical HBOT protocols differ widely in pressure, session count, and duration, and the animal dosing rarely matches clinical exposure.\n\nHuman evidence on HBOT and ovarian reserve specifically appears thin and mostly indirect.\n\n## Where we need help\n\nBefore designing any study or counseling patients, we need to know what the existing evidence actually supports: the direction and dose-dependence of the redox effect in ovarian tissue, the quality of the interventional controls in the animal literature, which ovarian-reserve measurements are comparable across studies, whether any direct evidence ties HBOT to primordial follicle activation or loss rates, and how animal dosing could translate to clinical HBOT regimens.\n\nThe confounder list includes concurrent oxidative exposures, age, and indication-for-treatment itself.\n",
  "questions": [
    {
      "question_id": "CQ-01",
      "statement": "在重复高压氧暴露下，卵巢组织中氧化-抗氧化净效应的方向是什么，其剂量/方案依赖性如何？",
      "source_trace": [
        {
          "exact_quote": "So the net direction of the redox effect in ovarian tissue under repeated hyperoxic exposure is genuinely unresolved."
        }
      ],
      "question_type": "MECHANISM",
      "dependencies": [],
      "resolution_condition": "证据条件：卵巢组织在高压/高氧暴露下 ROS 水平与抗氧化标志物（SOD、CAT、GPx、MDA 等）的定量测量，按方案参数（压力、次数、时长）分层后的效应方向。双向证据并存时，方向切换的条件本身即为问题的解决状态。",
      "uncertainty": "叙事明确双向假设均有组织学外证据支持（促氧化：ROS 驱动原始卵泡过度激活；抗氧化：上调抗氧化防御）；方向未定是本问题的起点而非待清除的噪声。"
    },
    {
      "question_id": "CQ-02",
      "statement": "现有 HBOT-卵巢动物实验的对照设置（常氧高压、常压氧、假处理）是否足以把观察到的效应归因于高压氧本身？",
      "source_trace": [
        {
          "exact_quote": "the quality of the interventional controls in the animal literature"
        }
      ],
      "question_type": "INTERVENTION_OR_CONTROL",
      "dependencies": [],
      "resolution_condition": "证据条件：HBOT-卵巢动物实验中每个效应主张所对应的对照设置（常氧高压 / 常压供氧 / 假处理）、随机化与盲法状态。对照质量决定效应归因于高压氧本身的强度分层；该分层即问题的解决状态。",
      "uncertainty": null
    },
    {
      "question_id": "CQ-03",
      "statement": "卵巢储备的三类测量（血清 AMH、窦卵泡计数 AFC、组织学原始卵泡计数）在跨研究比较中的效度与可比性如何？",
      "source_trace": [
        {
          "exact_quote": "measured by AMH levels, antral follicle counts, and histological primordial follicle counts"
        }
      ],
      "question_type": "MEASUREMENT_OR_OBSERVABILITY",
      "dependencies": [],
      "resolution_condition": "证据条件：AMH、AFC、组织学原始卵泡计数三类卵巢储备测量各自的信度/效度证据与已知偏差记录，以及跨物种、跨批次可比性的方法学证据。三者共同决定跨研究比较的可行边界。",
      "uncertainty": null
    },
    {
      "question_id": "CQ-04",
      "statement": "是否有直接证据（以原始卵泡激活或丢失率为终点）表明 HBOT 改变卵巢储备的消耗速率？",
      "source_trace": [
        {
          "exact_quote": "whether any direct evidence ties HBOT to primordial follicle activation or loss rates"
        }
      ],
      "question_type": "CAUSAL_CLAIM",
      "dependencies": [
        "CQ-02"
      ],
      "resolution_condition": "证据条件（依赖 CQ-02 的对照质量分层）：以原始卵泡激活率或丢失率为直接终点的 HBOT 研究证据。存在则按对照质量定级记录；不存在则状态为『直接证据缺失』——这是证据缺口，不得当作阴性结论。",
      "uncertainty": "叙事中的『preoperatively can preserve』说法来自卵巢缺血再灌注损伤模型；该保护效应外推到健康卵巢或临床 HBOT 人群未经证实，需保持假设状态。"
    },
    {
      "question_id": "CQ-05",
      "statement": "动物 HBOT 剂量方案向临床 HBOT 方案的外推效度如何，暴露量差距有多大？",
      "source_trace": [
        {
          "exact_quote": "Clinical HBOT protocols differ widely in pressure, session count, and duration, and the animal dosing rarely matches clinical exposure."
        }
      ],
      "question_type": "TRANSLATION",
      "dependencies": [
        "CQ-04"
      ],
      "resolution_condition": "证据条件（依赖 CQ-04 的直接证据研究集）：这些研究的动物暴露参数（压力 ATA、频次、总时长）与临床 HBOT 常规方案参数之间的差距本身。差距的大小即为外推效度的证据状态。",
      "uncertainty": null
    }
  ]
}
