{
  "artifact_id": "CQS-CQC-P2-06",
  "schema_version": "0.1",
  "source_narrative_sha256": "95f91f7c8dec4ece9f973a2607b8b8f5988963a83abf09fb11228c8a050da92d",
  "source_narrative": "请帮我查证一件事：Gould 2022 年那篇 Cell Reports 论文的补充材料里，到底有没有单细胞层面的海马体细胞类型注释表。\n",
  "questions": [
    {
      "question_id": "CQ-01",
      "statement": "Gould 2022 年 Cell Reports 论文（作者 + 年份 + 期刊的模糊指称）的补充材料中，是否包含单细胞层面的海马体细胞类型注释表？",
      "source_trace": [
        {
          "exact_quote": "Gould 2022 年那篇 Cell Reports 论文的补充材料里"
        },
        {
          "exact_quote": "单细胞层面的海马体细胞类型注释表"
        }
      ],
      "question_type": "SOURCE_CONTENT",
      "dependencies": [],
      "resolution_condition": "证据条件：先以作者/年份/期刊锚定论文身份（消解模糊指称），再核对其补充材料内容——存在该注释表（给出表标识）/不存在（记录明确的不存在）。身份未定或补充材料不可及时，状态为『无法确认』而非否定。",
      "uncertainty": "指称模糊：『Gould 2022』与『Cell Reports』的组合可能对应多篇论文/多位 Gould；源未给标题或 DOI。论文定位是本问题的执行路径而非独立证据景观，故不拆分为单独问题。"
    }
  ]
}
