{
  "artifact_id": "CQS-CQC-P2-06-R1",
  "schema_version": "0.1",
  "source_narrative_sha256": "95f91f7c8dec4ece9f973a2607b8b8f5988963a83abf09fb11228c8a050da92d",
  "source_narrative": "请帮我查证一件事：Gould 2022 年那篇 Cell Reports 论文的补充材料里，到底有没有单细胞层面的海马体细胞类型注释表。\n",
  "questions": [
    {
      "question_id": "CQ-01",
      "statement": "Gould 2022 年 Cell Reports 论文（作者 + 年份 + 期刊的模糊指称）的补充材料中，是否包含单细胞层面的海马体细胞类型注释表？",
      "source_trace": [
        {
          "exact_quote": "Gould 2022 年那篇 Cell Reports 论文的补充材料里"
        },
        {
          "exact_quote": "单细胞层面的海马体细胞类型注释表"
        }
      ],
      "question_type": "SOURCE_CONTENT",
      "dependencies": [],
      "resolution_condition": "证据条件：论文身份（经指称消解确认）与其补充材料内容共同构成证据——身份确认且内容含该注释表→『存在』（给出表标识）；身份不可消解或材料不可及→『无法确认』；身份确认且材料明确不含→『明确不存在』。标题与描述层面的推断不足以裁决。",
      "uncertainty": "指称模糊（『Gould 2022』×『Cell Reports』可能对应多篇论文；源未给标题/DOI）。论文身份在本案例中按执行前置处理（消解指称是回答手段）；若下游需要将论文身份作为独立证据对象（如引用谱系分析），边界依用途重开——当前保留未决。"
    }
  ]
}
